<?xml version="1.0" encoding="utf-8"?>
<IndirectUI xmlns:xsi="http://www.w3.org/2001/XMLSchema-instance" xsi:noNamespaceSchemaLocation="Schema\IndirectUI.xsd">
	<Panel Name="First" Text="First Tab">
		<Controls>
			<AngleChooser Name="AngleChooser1" />
			<CheckBox Name="CheckBox1" 
					  DisplayName="Make ReadOnly 1" />
			<ColorWheel Name="ColorWheel1" 
						DisplayName="Test Color Wheel" 
						Value="#FFFF0000" 
						Alpha="true">
				<BoundToBoolean SourceControl="CheckBox1" />
			</ColorWheel>
			<IntSlider Name="IntSlider1"
                       DisplayName="Hello IntSlider"
                       MinValue="50"
                       MaxValue="100"
                       ShowResetButton="false">
				<BoundToBoolean SourceControl="CheckBox1" />
				<ControlColors>
					<Color>#FF0000</Color>
					<Color>#00FF00</Color>
					<Color>#0000FF</Color>
				</ControlColors>
			</IntSlider>
			<Container>
				<Panel Name="Nested First" 
					   Text="Nested First Tab">
					<Controls>
						<CheckBox Name="CheckBox2" 
								  DisplayName="Make ReadOnly 2" />
						<DoubleSlider Name="DoubleSlider1"
                                      DisplayName="Hello DoubleSlider1"
                                      MinValue="0"
                                      MaxValue="1"
                                      SliderSmallChange=".01"
                                      SliderLargeChange=".05"
                                      UpDownIncrement=".01"
                                      DecimalPlaces="2">
							<BoundToBoolean SourceControl="CheckBox2" />
						</DoubleSlider>
						<DoubleVector3RollBallAndSlider Name="RollBallAndSlider1">
							<BoundToBoolean SourceControl="CheckBox2" 
											Inverse="true" />
						</DoubleVector3RollBallAndSlider>
						<DoubleVector3Slider Name="Vector3Slider1">
							<BoundToBoolean SourceControl="CheckBox2" />
						</DoubleVector3Slider>
					</Controls>
				</Panel>
				<Panel Name="Nested Second" 
					   Text="Nested Second Tab">
					<Controls>
						<CheckBox Name="CheckBox3" 
								  DisplayName="Make ReadOnly 3" />
						<DoubleVectorPanAndSlider Name="PanAndSlider"
                                                  StaticImageUnderlay="iVBORw0KGgoAAAANSUhEUgAAABgAAAAYCAYAAADgdz34AAAABHNCSVQICAgIfAhkiAAAAAlwSFlzAAAApgAAAKYB3X3/OAAAABl0RVh0U29mdHdhcmUAd3d3Lmlua3NjYXBlLm9yZ5vuPBoAAANCSURBVEiJtZZPbBtFFMZ/M7ubXdtdb1xSFyeilBapySVU8h8OoFaooFSqiihIVIpQBKci6KEg9Q6H9kovIHoCIVQJJCKE1ENFjnAgcaSGC6rEnxBwA04Tx43t2FnvDAfjkNibxgHxnWb2e/u992bee7tCa00YFsffekFY+nUzFtjW0LrvjRXrCDIAaPLlW0nHL0SsZtVoaF98mLrx3pdhOqLtYPHChahZcYYO7KvPFxvRl5XPp1sN3adWiD1ZAqD6XYK1b/dvE5IWryTt2udLFedwc1+9kLp+vbbpoDh+6TklxBeAi9TL0taeWpdmZzQDry0AcO+jQ12RyohqqoYoo8RDwJrU+qXkjWtfi8Xxt58BdQuwQs9qC/afLwCw8tnQbqYAPsgxE1S6F3EAIXux2oQFKm0ihMsOF71dHYx+f3NND68ghCu1YIoePPQN1pGRABkJ6Bus96CutRZMydTl+TvuiRW1m3n0eDl0vRPcEysqdXn+jsQPsrHMquGeXEaY4Yk4wxWcY5V/9scqOMOVUFthatyTy8QyqwZ+kDURKoMWxNKr2EeqVKcTNOajqKoBgOE28U4tdQl5p5bwCw7BWquaZSzAPlwjlithJtp3pTImSqQRrb2Z8PHGigD4RZuNX6JYj6wj7O4TFLbCO/Mn/m8R+h6rYSUb3ekokRY6f/YukArN979jcW+V/S8g0eT/N3VN3kTqWbQ428m9/8k0P/1aIhF36PccEl6EhOcAUCrXKZXXWS3XKd2vc/TRBG9O5ELC17MmWubD2nKhUKZa26Ba2+D3P+4/MNCFwg59oWVeYhkzgN/JDR8deKBoD7Y+ljEjGZ0sosXVTvbc6RHirr2reNy1OXd6pJsQ+gqjk8VWFYmHrwBzW/n+uMPFiRwHB2I7ih8ciHFxIkd/3Omk5tCDV1t+2nNu5sxxpDFNx+huNhVT3/zMDz8usXC3ddaHBj1GHj/As08fwTS7Kt1HBTmyN29vdwAw+/wbwLVOJ3uAD1wi/dUH7Qei66PfyuRj4Ik9is+hglfbkbfR3cnZm7chlUWLdwmprtCohX4HUtlOcQjLYCu+fzGJH2QRKvP3UNz8bWk1qMxjGTOMThZ3kvgLI5AzFfo379UAAAAASUVORK5CYII=">
							<BoundToBoolean SourceControl="CheckBox3" />
						</DoubleVectorPanAndSlider>
						<DropDown Name="DropDown1"
                                  DisplayName="Menü"
                                  Description="Description here...">
							<BoundToBoolean SourceControl="CheckBox3" />
							<Choice>Choice 1</Choice>
							<Choice>Choice 2</Choice>
							<Choice>Choice 3</Choice>
						</DropDown>
						<FileChooser Name="FileChooser1"
                                     AllowAllFiles="true">
						</FileChooser>
						<FolderChooser Name="FolderChooser1" />
					</Controls>
				</Panel>
			</Container>
		</Controls>
	</Panel>
	<Panel Name="Second" Text="Second Tab">
		<Controls>
			<CheckBox Name="CheckBox4" 
					  DisplayName="Make ReadOnly 4" />
			<IncrementButton Name="IncrementButton1" 
							 ButtonText="Click Me!">
				<BoundToBoolean SourceControl="CheckBox4" />
			</IncrementButton>
			<LinkLabel Name="LinkLabel1" 
					   DisplayName="Google" 
					   Value="http://www.google.com" />
			<RadioButton Name="RadioButton1" 
						 DisplayName="Radio Choice">
				<BoundToBoolean SourceControl="CheckBox4" />
				<Choice>Choice 1</Choice>
				<Choice>Choice 2</Choice>
				<Choice>Choice 3</Choice>
			</RadioButton>
		</Controls>
	</Panel>
</IndirectUI>